{
  "$schema": "https://json-schema.org/draft/2020-12/schema",
  "$id": "https://veritas-os.local/schemas/manifest-change-receipt-v1.schema.json",
  "title": "Manifest Change Receipt v1",
  "description": "Schema-only governance receipt that records changes to governance manifests. It is non-enforcing in v1.",
  "type": "object",
  "additionalProperties": false,
  "required": [
    "schema_version",
    "receipt_id",
    "issued_at",
    "changed_manifest_type",
    "changed_manifest_id",
    "previous_manifest_hash",
    "new_manifest_hash",
    "change_reason",
    "changed_by",
    "authority_evidence_ref",
    "approval_evidence_refs",
    "impact_scope",
    "legitimacy_impact_flags",
    "rollback_conditions"
  ],
  "properties": {
    "schema_version": {
      "const": "manifest-change-receipt-v1"
    },
    "receipt_id": {
      "type": "string",
      "minLength": 1
    },
    "issued_at": {
      "type": "string",
      "format": "date-time"
    },
    "changed_manifest_type": {
      "enum": [
        "root_authority_manifest",
        "evaluation_function_manifest",
        "other_governance_manifest"
      ]
    },
    "changed_manifest_id": {
      "type": "string",
      "minLength": 1
    },
    "previous_manifest_hash": {
      "$ref": "#/$defs/sha256_hex"
    },
    "new_manifest_hash": {
      "$ref": "#/$defs/sha256_hex"
    },
    "change_reason": {
      "type": "string",
      "minLength": 1
    },
    "changed_by": {
      "$ref": "#/$defs/changed_by"
    },
    "authority_evidence_ref": {
      "type": "string",
      "minLength": 1
    },
    "approval_evidence_refs": {
      "type": "array",
      "minItems": 1,
      "items": {
        "type": "string",
        "minLength": 1
      }
    },
    "impact_scope": {
      "type": "array",
      "minItems": 1,
      "items": {
        "type": "string",
        "minLength": 1
      }
    },
    "legitimacy_impact_flags": {
      "type": "array",
      "items": {
        "$ref": "#/$defs/legitimacy_impact_flag"
      },
      "uniqueItems": true
    },
    "rollback_conditions": {
      "type": "array",
      "minItems": 1,
      "items": {
        "type": "string",
        "minLength": 1
      }
    }
  },
  "$defs": {
    "sha256_hex": {
      "type": "string",
      "pattern": "^[0-9a-f]{64}$"
    },
    "changed_by": {
      "type": "object",
      "additionalProperties": false,
      "required": [
        "actor_id",
        "role"
      ],
      "properties": {
        "actor_id": {
          "type": "string",
          "minLength": 1
        },
        "role": {
          "type": "string",
          "minLength": 1
        }
      }
    },
    "legitimacy_impact_flag": {
      "type": "string",
      "minLength": 1,
      "description": "Examples include authority_scope_expanded, human_oversight_weakened, refusal_boundary_relaxed, escalation_requirement_reduced, policy_source_changed, and evaluator_behavior_changed."
    }
  }
}
